<settings xmlns="urn:jboss:messaging"
            xmlns:xsi="http://www.w3.org/2001/XMLSchema-instance"
            xsi:schemaLocation="urn:jboss:messaging ../schemas/jbm-queues.xsd ">

   <!-- any user can have full control of generic topics -->
   <security match="jms.topic.#">
      <permission type="createDurableQueue" roles="user"/>
      <permission type="deleteDurableQueue" roles="user"/>
      <permission type="createTempQueue" roles="user"/>
      <permission type="deleteTempQueue" roles="user"/>
      <permission type="send" roles="user"/>
      <permission type="consume" roles="user"/>
   </security>

   <security match="jms.topic.news.europe.#">
      <permission type="createDurableQueue" roles="user"/>
      <permission type="deleteDurableQueue" roles="user"/>
      <permission type="createTempQueue" roles="user"/>
      <permission type="deleteTempQueue" roles="user"/>
      <permission type="send" roles="europe-user"/>
      <permission type="consume" roles="news-user"/>
   </security>

   <security match="jms.topic.news.us.#">
      <permission type="createDurableQueue" roles="user"/>
      <permission type="deleteDurableQueue" roles="user"/>
      <permission type="createTempQueue" roles="user"/>
      <permission type="deleteTempQueue" roles="user"/>
      <permission type="send" roles="us-user"/>
      <permission type="consume" roles="news-user"/>
   </security>

</settings>
