<settings xmlns="urn:jboss:messaging"
            xmlns:xsi="http://www.w3.org/2001/XMLSchema-instance"
            xsi:schemaLocation="urn:jboss:messaging ../schemas/jbm-queues.xsd ">

   <!--security for example queue-->
   <security match="jms.queue.exampleQueue">
      <permission type="createDurableQueue" roles="guest"/>
      <permission type="deleteDurableQueue" roles="guest"/>
      <permission type="createTempQueue" roles="guest"/>
      <permission type="deleteTempQueue" roles="guest"/>
      <permission type="consume" roles="guest"/>
      <permission type="send" roles="guest"/>
   </security>
   
   <security match="jms.queue.pagingQueue">
      <permission type="createDurableQueue" roles="guest"/>
      <permission type="deleteDurableQueue" roles="guest"/>
      <permission type="createTempQueue" roles="guest"/>
      <permission type="deleteTempQueue" roles="guest"/>
      <permission type="consume" roles="guest"/>
      <permission type="send" roles="guest"/>
   </security>
   
   <address-settings match="jms.queue.pagingQueue">
      <max-size-bytes>100000</max-size-bytes>
      <page-size-bytes>20000</page-size-bytes>
   </address-settings>

</settings>
