<settings xmlns="urn:jboss:messaging"
            xmlns:xsi="http://www.w3.org/2001/XMLSchema-instance"
            xsi:schemaLocation="urn:jboss:messaging ../schemas/jbm-queues.xsd ">

   <!--security for example queue-->
   <security match="queuejms.exampleQueue">
      <permission type="createDurableQueue" roles="guest"/>
      <permission type="deleteDurableQueue" roles="guest"/>
      <permission type="createTempQueue" roles="guest"/>
      <permission type="deleteTempQueue" roles="guest"/>
      <permission type="consume" roles="guest"/>
      <permission type="send" roles="guest"/>
   </security>

   <!--security for dead letter queue-->
   <security match="queuejms.expiryQueue">
      <permission type="createDurableQueue" roles="guest"/>
      <permission type="deleteDurableQueue" roles="guest"/>
      <permission type="createTempQueue" roles="guest"/>
      <permission type="deleteTempQueue" roles="guest"/>
      <permission type="consume" roles="guest"/>
      <permission type="send" roles="guest"/>
   </security>

   <!--override the expiry address for the example-->
   <address-settings match="queuejms.exampleQueue">
      <expiry-address>queuejms.expiryQueue</expiry-address>
   </address-settings>

</settings>
