<settings xmlns="urn:jboss:messaging" 
            xmlns:xsi="http://www.w3.org/2001/XMLSchema-instance" 
            xsi:schemaLocation="urn:jboss:messaging ../schemas/jbm-queues.xsd ">

   <!--  management address -->
   <security match="jbm.management">
      <!--  only the admin role can interact with the management address  -->
      <permission type="consume" roles="admin"/>
      <permission type="send" roles="admin"/>
      <permission type="manage" roles="admin"/>
   </security>
<!--example queue or topic configuration-->
   <!--<security match="jms.queue.#">
      <permission type="consume" roles="guest,publisher"/>
      <permission type="send" roles="guest,publisher"/>
   </security>-->
   <!--<security match="jms.topic.#">
      <permission type="consume" roles="guest,publisher"/>
      <permission type="send" roles="guest,publisher"/>
   </security>-->

   <!-- example temp queue or topic configuration -->
   <!--<security match="jms.tempqueue.#">
      <permission type="createTempQueue" roles="guest"/>
      <permission type="deleteTempQueue" roles="guest"/>
      <permission type="consume" roles="guest"/>
      <permission type="send" roles="guest"/>
   </security>

   <security match="jms.temptopic.#">
      <permission type="createTempQueue" roles="guest"/>
      <permission type="deleteTempQueue" roles="guest"/>
      <permission type="consume" roles="guest"/>
      <permission type="send" roles="guest"/>
   </security>-->

   <!--default security to catch all-->
   <security match="#">
      <permission type="createDurableQueue" roles="guest"/>
      <permission type="deleteDurableQueue" roles="guest"/>
      <permission type="createTempQueue" roles="guest"/>
      <permission type="deleteTempQueue" roles="guest"/>
      <permission type="consume" roles="guest"/>
      <permission type="send" roles="guest"/>
   </security>

   <!--default for catch all-->
   <address-settings match="#">
      <clustered>false</clustered>
      <dead-letter-address>jms.queue.DLQ</dead-letter-address>
      <expiry-address>jms.queue.ExpiryQueue</expiry-address>
      <redelivery-delay>0</redelivery-delay>
      <max-size-bytes>-1</max-size-bytes>
      <page-size-bytes>10485760</page-size-bytes>
      <distribution-policy-class>org.jboss.messaging.core.server.impl.RoundRobinDistributor</distribution-policy-class>
      <message-counter-history-day-limit>10</message-counter-history-day-limit>
   </address-settings>
</settings>
