<settings xmlns="urn:jboss:messaging" 
            xmlns:xsi="http://www.w3.org/2001/XMLSchema-instance" 
            xsi:schemaLocation="urn:jboss:messaging ../schemas/jbm-queues.xsd ">

   <security match="jms.queue.testQueue">
      <permission type="consume" roles="guest,publisher"/>
      <permission type="send" roles="guest,publisher"/>
   </security>

   <!--default for catch all-->
   <address-settings match="#">
      <clustered>false</clustered>
      <dead-letter-address>jms.queue.DLQ</dead-letter-address>
      <expiry-address>jms.queue.ExpiryQueue</expiry-address>
      <redelivery-delay>0</redelivery-delay>
      <max-size-bytes>-1</max-size-bytes>
      <page-size-bytes>10485760</page-size-bytes>
      <distribution-policy-class>org.jboss.messaging.core.server.impl.RoundRobinDistributor</distribution-policy-class>
      <message-counter-history-day-limit>10</message-counter-history-day-limit>
   </address-settings>
</settings>
