<settings xmlns="urn:jboss:messaging" 
            xmlns:xsi="http://www.w3.org/2001/XMLSchema-instance" 
            xsi:schemaLocation="urn:jboss:messaging ../schemas/jbm-queues.xsd ">

   <!--  manangement address -->
   <security match="jbm.admin.management">
      <!--  only the admin role can interact with the management address  -->
      <permission type="consume" roles="admin"/>
      <permission type="send" roles="admin"/>
      <permission type="createDurableQueue" roles="admin"/>
      <permission type="deleteDurableQueue" roles="admin"/>
      <permission type="createTempQueue" roles="admin"/>
      <permission type="deleteTempQueue" roles="admin"/>
      <permission type="manage" roles="admin"/>
   </security>
   
   <security match="topicjms.exampleTopic">
      <permission type="createDurableQueue" roles="durpublisher"/>
      <permission type="deleteDurableQueue" roles="durpublisher"/>
      <permission type="consume" roles="guest,publisher,durpublisher"/>
      <permission type="send" roles="guest,publisher,durpublisher"/>
   </security>

   <security match="queuejms.exampleQueue">
      <permission type="consume" roles="guest,publisher"/>
      <permission type="send" roles="guest,publisher"/>
   </security>

   <security match="queuetempjms.*">
      <permission type="createTempQueue" roles="guest"/>
      <permission type="deleteTempQueue" roles="guest"/>
      <permission type="consume" roles="guest"/>
      <permission type="send" roles="guest"/>
   </security>

   <security match="topictempjms.*">
      <permission type="createTempQueue" roles="guest"/>
      <permission type="deleteTempQueue" roles="guest"/>
      <permission type="consume" roles="guest"/>
      <permission type="send" roles="guest"/>
   </security>

   <!--default security to catch all-->
   <security match="#">
      <permission type="createDurableQueue" roles="guest,def"/>
      <permission type="deleteDurableQueue" roles="guest,def"/>
      <permission type="createTempQueue" roles="guest,def"/>
      <permission type="deleteTempQueue" roles="guest,def"/>
      <permission type="consume" roles="guest,def"/>
      <permission type="send" roles="guest,def"/>
   </security>

</settings>
